,speech_type,proceeding,date,speaker_surname,country,speaker_name,country_code,position
2498,General debate,A_60_PV.10_E, 2005-09-17 ,Machimura,Japan,Nobutaka  Machimura,JPN,Minister for Foreign Affairs of Japan. Mr. Machimura (Japan): I should like
2499,General debate,A_60_PV.10_E, 2005-09-17 ,Freivalds,Sweden,Laila  Freivalds,SWE,Minister for Foreign Affairs of Sweden. Ms. Freivalds (Sweden): A small boy on the run remains vividly in my mind today
2500,General debate,A_60_PV.10_E, 2005-09-17 ,Al-Jaafari,Iraq,Ibrahim  Al-Jaafari,IRQ,Prime Minister of the Republic of Iraq 
2501,General debate,A_60_PV.10_E, 2005-09-17 ,Proust,Monaco,Jean-Paul  Proust,MCO,Secretary of State of the Principality of Monaco 
2502,General debate,A_60_PV.10_E, 2005-09-17 ,Zia,Bangladesh,Begum Khaleda  Zia,BGD,Prime Minister of the People(cid:146)s Republic of Bangladesh 
2503,General debate,A_60_PV.10_E, 2005-09-17 ,Obiang Nguema Mbasogo,Equatorial Guinea,Teodoro  Obiang Nguema Mbasogo,GNQ,President of the Republic of Equatorial Guinea 
2504,General debate,A_60_PV.10_E, 2005-09-17 ,Vázquez,Uruguay,Tabaré  Vázquez,URY,President of the Eastern Republic of Uruguay no reason whatsoever to give up the hope of a utopia
2505,General debate,A_60_PV.10_E, 2005-09-17 ,Ahmed,Somalia,Abdullahi Yusuf  Ahmed,SOM,President of the Transitional Federal Government of the Somali Democratic Republic 
2506,General debate,A_60_PV.10_E, 2005-09-17 ,Gasparovic,Slovakia,Ivan  Gasparovic,SVK,
2507,General debate,A_60_PV.10_E, 2005-09-17 ,Pohamba,Namibia,Hifikepunye  Pohamba,NAM,President of the Republic of Namibia 
2508,General debate,A_60_PV.10_E, 2005-09-17 ,Duarte Frutos,Paraguay,Nicanor  Duarte Frutos,PRY,President of the Republic of Paraguay 
2509,General debate,A_60_PV.10_E, 2005-09-17 ,Kibaki,Kenya,Mwai  Kibaki,KEN,President of the Republic of Kenya 
2510,General debate,A_60_PV.10_E, 2005-09-17 ,Hassanal Bolkiah,Brunei Darussalam,Sultan of Brunei Darussalam  Hassanal Bolkiah,BRN,
2511,General debate,A_60_PV.10_E, 2005-09-17 ,Mbeki,South Africa,Thabo  Mbeki,ZAF,President of the Republic of South Africa 
2512,General debate,A_60_PV.10_E, 2005-09-17 ,Ahmadinejad,Iran,Mahmoud  Ahmadinejad,IRN,President of the Islamic Republic of Iran We acknowledge with appreciation the valuable contribution made by the Secretary-General and his team to the ongoing reform process
2513,General debate,A_60_PV.10_E, 2005-09-17 ,Kumaratunga,Sri Lanka,Chandrika  Kumaratunga,LKA,President of the Democratic Socialist Republic of Sri Lanka 
2475,General debate,A_60_PV.11_E, 2005-09-18 ,Tarasyuk,Ukraine,Boris  Tarasyuk,UKR,Minister for Foreign Affairs of Ukraine. Mr. Tarasyuk (Ukraine): At the outset I wish to express my congratulations to you
2476,General debate,A_60_PV.11_E, 2005-09-18 ,Tokaev,Kazakhstan,Kasymzhomart  Tokaev,KAZ,Minister for Foreign Affairs of the Republic of Kazakhstan. Mr. Tokaev (Kazakhstan): We can safely claim that the United Nations summit that has just been concluded will have far-reaching implications for our Organization. Its outcome has prepared the ground for the most radical reform in the entire history of the United Nations. An effective response by the family of nations to global challenges and threats is the ultimate goal of its confidence that the United Nations
2477,General debate,A_60_PV.11_E, 2005-09-18 ,Menezes,Sao Tome and Principe,Fradique Bandeira Melo de  Menezes,STP,President of the Democratic Republic of Sao Tome and Principe 
2478,General debate,A_60_PV.11_E, 2005-09-18 ,Papadopoulos,Cyprus,Tassos  Papadopoulos,CYP,President of the Republic of Cyprus address by the President of the Republic of Cyprus. Mr. Tassos Papadopoulos
2479,General debate,A_60_PV.11_E, 2005-09-18 ,Mwanawasa,Zambia,Levy Patrick  Mwanawasa,ZMB,President and Minister for Defence of the Republic of Zambia address by the President of the Republic of Zambia. 
2480,General debate,A_60_PV.11_E, 2005-09-18 ,Toledo Manrique,Peru,Alejandro  Toledo Manrique,PER,President of the Republic of Peru address by the President of the Republic of Peru. 
2481,General debate,A_60_PV.11_E, 2005-09-18 ,Mugabe,Zimbabwe,Robert Gabriel  Mugabe,ZWE,President of the Republic of Zimbabwe 
2482,General debate,A_60_PV.11_E, 2005-09-18 ,Scotty,Nauru,Ludwig  Scotty,NRU,M. P.
2483,General debate,A_60_PV.11_E, 2005-09-18 ,Palacio,Ecuador,Alfredo  Palacio,ECU,President of the Republic of Ecuador address by the President of the Republic of Ecuador. 
2484,General debate,A_60_PV.12_E, 2005-09-18 ,Pabriks,Latvia,Artis  Pabriks,LVA,Minister for Foreign Affairs of Latvia. Mr. Pabriks (Latvia): Today
2485,General debate,A_60_PV.12_E, 2005-09-18 ,Murigande,Rwanda,Charles  Murigande,RWA,Minister for Foreign Affairs and Regional Cooperation of Rwanda. Mr. Murigande (Rwanda): Allow me to begin by congratulating the President of the General Assembly at its fifty-ninth session
2486,General debate,A_60_PV.12_E, 2005-09-18 ,Namaliu,Papua New Guinea,Rabbie  Namaliu,PNG,Minister and Immigration of Papua New Guinea. for Foreign Affairs Sir Rabbie L. Namaliu (Papua New Guinea): I bring greetings and congratulations to the President of the General Assembly from the Government and the people of Papua New Guinea on the occasion of the sixtieth anniversary of the United Nations. I pledge my delegations support in the discharge of his noble responsibilities. I would like to commend again His Excellency Mr. Jean Ping
2487,General debate,A_60_PV.12_E, 2005-09-18 ,Bielsa,Argentina,Rafael Antonio  Bielsa,ARG,Minister for Foreign Affairs
2488,General debate,A_60_PV.12_E, 2005-09-18 ,Mammadyarov,Azerbaijan,Elmar Maharram oglu  Mammadyarov,AZE,Minister for Foreign Affairs of Azerbaijan. Mr. Mammadyarov (Azerbaijan): At the outset I would like to congratulate you
2489,General debate,A_60_PV.12_E, 2005-09-18 ,Oskanian,Armenia,Vartan  Oskanian,ARM,Minister for Foreign Affairs of Armenia. Mr. Oskanian (Armenia): Let me first welcome you
2490,General debate,A_60_PV.12_E, 2005-09-18 ,Suphamongkhon,Thailand,Kantathi  Suphamongkhon,THA,Minister for Foreign Affairs of Thailand. Mr. Suphamongkhon (Thailand): On behalf of the delegation of Thailand
2491,General debate,A_60_PV.12_E, 2005-09-18 ,Douste-Blazy,France,Philippe  Douste-Blazy,FRA,Minister for Foreign Affairs of France. Mr. Douste-Blazy (France) (spoke in French): Speaking for the first time from this rostrum
2492,General debate,A_60_PV.12_E, 2005-09-18 ,Ban,Republic of Korea,1944-   Ki-moon Ban,KOR,the International Monetary Fund
2493,General debate,A_60_PV.12_E, 2005-09-18 ,Lavrov,Russian Federation,Sergei Viktorovich  Lavrov,RUS,Minister for Foreign Affairs of the Russian Federation. 10 Mr. Lavrov (Russian Federation) (spoke in Russian): In no way can todays discussion be called routine. We are faced with summing up the preliminary results of the large-scale United Nations reforms that have been launched and designating the main thrust for the work of the entire system of United Nations institutions in implementing the outcome document of the 2005 world summit. We propose to structure the work of the sixtieth session of the General Assembly in such a manner as to facilitate the broadest possible agreement on a number of conceptual issues related to strengthening the United Nations that will
2494,General debate,A_60_PV.12_E, 2005-09-18 ,Fini,Italy,Gianfranco  Fini,ITA,Deputy Prime Minister and Minister for Foreign Affairs of Italy. Mr. Fini (Italy) (spoke in French): Allow me at the outset to express my heartfelt congratulations to you
2495,General debate,A_60_PV.12_E, 2005-09-18 ,Malielegaoi,Samoa,Tuilaepa Sailele  Malielegaoi,WSM,Prime Minister and Minister for Foreign Affairs and Trade of the Independent State of Samoa 
2496,General debate,A_60_PV.12_E, 2005-09-18 ,Rodriguez Veltzé,Bolivia,Eduardo  Rodriguez Veltzé,BOL,President of the Republic of Bolivia 
2497,General debate,A_60_PV.12_E, 2005-09-18 ,Saca González,El Salvador,Eliás Antonio  Saca González,SLV,President of the Republic of El Salvador 
2448,General debate,A_60_PV.14_E, 2005-09-19 ,Al-Rumaihi,Qatar,Mohammed Abdulla  Al-Rumaihi,QAT,Deputy Minister for Foreign Affairs of Qatar. Mr. Al-Rumaihi (Qatar) (spoke in Arabic): It gives me great pleasure at the outset to extend to you
2449,General debate,A_60_PV.14_E, 2005-09-19 ,Rodríguez Araque,Venezuela,Ali  Rodríguez Araque,VEN,Minister for Foreign Affairs of the Bolivarian Republic of Venezuela. Mr. Rodriguez Araque (Venezuela) (spoke in Spanish): At the end of the first five years of the third millennium
2450,General debate,A_60_PV.14_E, 2005-09-19 ,Caldera Cardenal,Nicaragua,Norman José  Caldera Cardenal,NIC,Minister for Foreign Affairs of Nicaragua. Mr. Caldera Cardenal (Nicaragua) (spoke in Spanish): 
2451,General debate,A_60_PV.14_E, 2005-09-19 ,Rupel,Slovenia,Dimitrij  Rupel,SVN,Minister for Foreign Affairs of Slovenia. Mr. Rupel (Slovenia) (spoke in Slovenian; English text provided by the delegation): Allow me at the outset to congratulate you
2452,General debate,A_60_PV.14_E, 2005-09-19 ,Wirajuda,Indonesia,Hassan  Wirajuda,IDN,Minister for Foreign Affairs of Indonesia. Mr. Wirajuda (Indonesia): We live in an age of unpredictable threats
2453,General debate,A_60_PV.14_E, 2005-09-19 ,Singh,India,Natwar  Singh,IND,Minister for External Affairs of India. We to synthesize those ideas Mr. Singh are united (India): Your election
2454,General debate,A_60_PV.14_E, 2005-09-19 ,Amaral,Portugal,Diogo Freitas do  Amaral,PRT,Minister for Foreign Affairs of Portugal and former President of the General Assembly. Mr. Freitas do Amaral (Portugal) (spoke in Portuguese; English text provided by the delegation): I am returning to the Assembly Hall after 10 years. In September 1995
2455,General debate,A_60_PV.14_E, 2005-09-19 ,Molyviatis,Greece,Petros  Molyviatis,GRC,Minister for Foreign Affairs of Greece. Mr. Molyviatis (Greece): Let me begin
2456,General debate,A_60_PV.14_E, 2005-09-19 ,Abdallah,Tunisia,Abdelwaheb  Abdallah,TUN,Minister Affairs of Tunisia. Mr. Abdallah (Tunisia) (spoke in Arabic): It is my distinct pleasure to express to you and to your friendly country
2457,General debate,A_60_PV.14_E, 2005-09-19 ,Ahern,Ireland,Dermot  Ahern,IRL,Minister for Foreign Affairs of Ireland. 16 Mr. Ahern (Ireland): Sixty years ago
2458,General debate,A_60_PV.14_E, 2005-09-19 ,Asselborn,Luxembourg,Jean  Asselborn,LUX,the outgoing President of the General Assembly
2459,General debate,A_60_PV.14_E, 2005-09-19 ,Mosisili,Lesotho,Pakalitha Bethuel  Mosisili,LSO,Prime Minister and Minister for Defence and Public Service of the Kingdom of Lesotho 
2460,General debate,A_60_PV.14_E, 2005-09-19 ,Toafa,Tuvalu,Maatia  Toafa,TUV,Prime Minister
2461,General debate,A_60_PV.14_E, 2005-09-19 ,Alexandre,Haiti,Boniface  Alexandre,HTI,Interim President of the Republic of Haiti 
2462,General debate,A_60_PV.14_E, 2005-09-19 ,Jammeh,Gambia,A.J.J.  Jammeh,GMB,President of the Republic of the Gambia 
2463,General debate,A_60_PV.14_E, 2005-09-19 ,Mutharika,Malawi,Bingu Wa  Mutharika,MWI,President of the Republic of Malawi 
2435,General debate,A_60_PV.15_E, 2005-09-20 ,Ayeva,Togo,Zarifou  Ayeva,TGO,Minister of State
2436,General debate,A_60_PV.15_E, 2005-09-20 ,Briz Gutiérrez,Guatemala,José Alberto  Briz Gutiérrez,GTM,
2437,General debate,A_60_PV.15_E, 2005-09-20 ,Nazarov,Tajikistan,Talbak  Nazarov,TJK,Minister for Foreign Affairs of Tajikistan. Mr. Nazarov (Tajikistan) (spoke in Russian): 
2438,General debate,A_60_PV.15_E, 2005-09-20 ,Minoves-Triquell,Andorra,Juli  Minoves-Triquell,AND,Minister for Foreign Affairs
2439,General debate,A_60_PV.15_E, 2005-09-20 ,Mindaoudou,Niger,Aichatou  Mindaoudou,NER,Minister for Foreign Affairs
2440,General debate,A_60_PV.15_E, 2005-09-20 ,Calmy-Rey,Switzerland,Micheline  Calmy-Rey,CHE,Minister for Foreign Affairs of Switzerland. like to I would (Switzerland) Mrs. Calmy-Rey in French): congratulate you
2441,General debate,A_60_PV.15_E, 2005-09-20 ,Moratinos Cuyaubé,Spain,Miguel Angel  Moratinos Cuyaubé,ESP,Minister for Foreign Affairs and Cooperation of Spain. Mr. Moratinos Cuyaube (Spain) (spoke in Spanish): Sixty years ago at San Francisco
2442,General debate,A_60_PV.15_E, 2005-09-20 ,Bedjaoui,Algeria,Mohammed  Bedjaoui,DZA,Minister of State and Minister for Foreign Affairs of Algeria. Mr. Bedjaoui (Algeria) (spoke in French): At this crucial moment
2443,General debate,A_60_PV.15_E, 2005-09-20 ,Al-Sabah,Kuwait,Mohammad Al-Sabah Al-Salem  Al-Sabah,KWT,Minister for Foreign Affairs of the State of Kuwait. Sheikh Mohammad Al-Sabah Al-Salem Al- Sabah (Kuwait) (spoke in Arabic): A few days ago
2444,General debate,A_60_PV.15_E, 2005-09-20 ,Shalom,Israel,Silvan  Shalom,ISR,Deputy Prime Minister and Minister for Foreign Affairs of Israel. Mr. Shalom (Israel): It is my unique pleasure to praise His Excellency Ambassador Dan Gillerman
2445,General debate,A_60_PV.15_E, 2005-09-20 ,Lengsavad,Lao People's Democratic Republic,Somsavat  Lengsavad,LAO,Deputy Prime Minister and Minister for Foreign Affairs of the Lao Peoples Democratic Republic. Mr. Lengsavad (Lao Peoples Democratic Republic) (spoke in Laotian; English text provided by the delegation): At the outset I would like to congratulate you upon your unanimous election as President of the sixtieth session of the General Assembly. I am confident that with your experience and diplomatic skills you will guide our deliberations to a successful outcome. I would also like to convey our great appreciation to His Excellency Mr. Jean Ping
2446,General debate,A_60_PV.15_E, 2005-09-20 ,Gomes,Guinea-Bissau,Jr.   Carlos Gomes,GNB,Jr.
2447,General debate,A_60_PV.15_E, 2005-09-20 ,Tong,Kiribati,Anote  Tong,KIR,President of the Republic of Kiribati 
2419,General debate,A_60_PV.16_E, 2005-09-20 ,Jusys,Lithuania,Oskaras  Jusys,LTU,Secretary for Foreign Affairs of Lithuania. Mr. Jusys (Lithuania): Lithuania welcomes this effort — the most extensive and ambitious ever made — to renew the United Nations. We must ensure that the summit commitments we all have undertaken are implemented and that they produce real and tangible results
2420,General debate,A_60_PV.16_E, 2005-09-20 ,Scharioth,Germany,Klaus  Scharioth,DEU,Deputy Minister for Foreign Affairs of Germany. Mr. Scharioth (Germany) (spoke in German; English text provided by the delegation): Please accept my congratulations
2421,General debate,A_60_PV.16_E, 2005-09-20 ,Zourabichvili,Georgia,Salomé  Zourabichvili,GEO,Minister for Foreign Affairs of Georgia. Mrs. Zourabichvili (Georgia) (spoke in French): I should first like to congratulate Mr. Jan Eliasson on his election as President at the sixtieth session of the General Assembly. I assure him of my delegations full support for the important work to be accomplished at this session. I would also like to extend my gratitude to His Excellency Mr. Jean Ping for his tireless efforts and vision for change he has demonstrated so amply during his presidency. (spoke in English) Our Organization is now at a turning point in its history. Sixty years after its founding
2422,General debate,A_60_PV.16_E, 2005-09-20 ,Chan,Solomon Islands,Laurie  Chan,SLB,Minister for Foreign Affairs of the Solomon Islands. Mr. Chan (Solomon Islands): I bring warm greetings
2423,General debate,A_60_PV.16_E, 2005-09-20 ,Ramos-Horta,Timor-Leste,José  Ramos-Horta,TLS,Minister for Foreign Affairs and Cooperation of Timor- Leste. Mr. Ramos-Horta (Timor-Leste): Because of the constraints on our time
2424,General debate,A_60_PV.16_E, 2005-09-20 ,Kaba-Sidibé,Guinea,Fatoumata  Kaba-Sidibé,GIN,Minister for Foreign Affairs of Guinea. Mrs. Kaba-Sidibe (Guinea) (spoke in French): Allow me at the outset
2425,General debate,A_60_PV.16_E, 2005-09-20 ,Bot,Netherlands,Bernard Rudolf  Bot,NLD,Minister for Foreign Affairs of the Netherlands. Mr. Bot (Netherlands): It is my firm opinion that we achieved important results at our summit. We created a peacebuilding commission and agreed to establish a human rights council. We have good language on development
2426,General debate,A_60_PV.16_E, 2005-09-20 ,Soefo,Comoros,Aboudou  Soefo,COM,Minister of State
2427,General debate,A_60_PV.16_E, 2005-09-20 ,Berardi,San Marino,Fabio  Berardi,SMR,Minister for Foreign and Political Affairs of San Marino. Mr. Berardi (San Marino) (spoke in Italian; English text furnished by the delegation): On behalf of the Government of the Republic of San Marino
2428,General debate,A_60_PV.16_E, 2005-09-20 ,Ngoupandé,Central African Republic,Jean-Paul  Ngoupandé,CAF,Minister for Foreign and Francophonie of the Central African Republic. Integration Regional Affairs
2429,General debate,A_60_PV.16_E, 2005-09-20 ,Moller,Denmark,Per Stig  Moller,DNK,as well as with all parties concerned
2430,General debate,A_60_PV.16_E, 2005-09-20 ,Ould Sid'Ahmed,Mauritania,Ahmed  Ould Sid'Ahmed,MRT,Minister for Foreign Affairs and Cooperation of Mauritania. Mr. Ahmed (Mauritania) (spoke in Arabic): On behalf of the Islamic Republic of Mauritania
2431,General debate,A_60_PV.16_E, 2005-09-20 ,Mitreva,The former Yugoslav Republic of Macedonia,Ilinka  Mitreva,MKD,Minister for Foreign Affairs of the former Yugoslav Republic of Macedonia. Mrs. Mitreva (
2432,General debate,A_60_PV.16_E, 2005-09-20 ,Oddsson,Iceland,David  Oddsson,ISL,Minister for Foreign Affairs and External Trade of Iceland. Mr. Oddsson (Iceland): I would like to join those who have expressed thanks to the Secretary-General for his efforts in recent years to address the very serious issues facing the international community. Iceland had high expectations for the results of last weeks summit
2433,General debate,A_60_PV.16_E, 2005-09-20 ,Benaissa,Morocco,Mohamed  Benaissa,MAR,Minister for Foreign Affairs and Cooperation of Morocco. Mr. Benaissa (Morocco) (spoke in Arabic): I should like to begin by congratulating Ambassador Jan Eliasson
2434,General debate,A_60_PV.16_E, 2005-09-20 ,Plassnik,Austria,Ursula  Plassnik,AUT,Federal Minister for Foreign Affairs of Austria. Ms. Plassnik (Austria): We Austrians unfailingly keep the United Nations in high esteem. Let me try to explain why. Austria became a Member of the United Nations in December 1955. That was only half a year after our full sovereignty had been restored through a treaty concluded with the United States
2415,General debate,A_60_PV.17_E, 2005-09-20 ,Díaz Paniagua,Costa Rica,Carlos  Díaz Paniagua,CRI,
2416,General debate,A_60_PV.17_E, 2005-09-20 ,O'Brien,United States,Robert C.  O'Brien,USA,
2417,General debate,A_60_PV.17_E, 2005-09-20 ,Fal,Gambia,Alhaji Omar  Fal,GMB,
2418,General debate,A_60_PV.17_E, 2005-09-20 ,Beck,Solomon Islands,Collin D.  Beck,SLB,
2387,General debate,A_60_PV.18_E, 2005-09-21 ,Svoboda,Czech Republic,Cyril  Svoboda,CZE,Minister for Foreign Affairs of the Czech Republic. Mr. Svoboda (Czech Republic): Let me begin by congratulating Mr. Eliasson on his election to the 20 presidency. He is at the steering wheel of one of the most challenging sessions of the General Assembly in history — not only because the sixtieth anniversary of our Organization but mainly because of our agenda and the gravity of problems awaiting resolution. While thanking his able and devoted predecessor
2404,General debate,A_60_PV.18_E, 2005-09-21 ,Baconschi,Romania,Teodor  Baconschi,ROU,Secretary of State for Global Affairs
2405,General debate,A_60_PV.18_E, 2005-09-21 ,Walker,Chile,Ignacio  Walker,CHL,Minister for Foreign Affairs of the Republic of Chile. Mr. Walker (Chile) (spoke in Spanish): I am pleased to commend the President
2406,General debate,A_60_PV.18_E, 2005-09-21 ,Kasuri,Pakistan,Khurshid M.  Kasuri,PAK,Minister for Foreign Affairs of Pakistan. Mr. Kasuri (Pakistan): Let me congratulate the President of the current session and former President Jean Ping for the success of the historic sixtieth anniversary summit. We admire the dedication and skill with which President Ping conducted the preparations for the summit. We thank the Secretary- General for his initiative to convene the summit and his numerous constructive ideas to advance development and United Nations reform. issues. However
2407,General debate,A_60_PV.18_E, 2005-09-21 ,Kutesa,Uganda,Sam K.  Kutesa,UGA,Minister for Foreign Affairs of the Republic of Uganda. 22 Mr. Kutesa (Uganda): I should like first of all to congratulate you
2408,General debate,A_60_PV.18_E, 2005-09-21 ,Munkh-Orgil,Mongolia,Tsend  Munkh-Orgil,MNG,Minister for Foreign Affairs of Mongolia. Mr. Munkh-Orgil (Mongolia): Let me begin by congratulating the President of the fifty-ninth session of the General Assembly
2409,General debate,A_60_PV.18_E, 2005-09-21 ,Shaheed,Maldives,Ahmed  Shaheed,MDV,Minister for Foreign Affairs of the Maldives. Mr. Shaheed (Maldives): Mr. President
2410,General debate,A_60_PV.18_E, 2005-09-21 ,Pettigrew,Canada,Pierre Stewart  Pettigrew,CAN,Minister for Foreign Affairs of Canada. Mr. Pettigrew (Canada) (spoke in French): 
2411,General debate,A_60_PV.18_E, 2005-09-21 ,Insanally,Guyana,Samuel R.  Insanally,GUY,Minister for Foreign Affairs of the Republic of Guyana and the former President of the General Assembly. Mr. Insanally (Guyana): Following closely
2412,General debate,A_60_PV.18_E, 2005-09-21 ,Aboul Gheit,Egypt,Ahmed  Aboul Gheit,EGY,Minister for Foreign Affairs of the Arab Republic of Egypt. Mr. Aboul Gheit (Egypt) (spoke in Arabic): At this session we celebrate the sixtieth anniversary of the establishment of the United Nations. We also begin
2413,General debate,A_60_PV.18_E, 2005-09-21 ,Downer,Australia,Alexander  Downer,AUS,Minister for Foreign Affairs of Australia. Mr. Downer (Australia): Australia is a founding Member of the United Nations
2414,General debate,A_60_PV.18_E, 2005-09-21 ,Gül,Turkey,Abdullah  Gül,TUR,Deputy Prime Minister and Minister for Foreign Affairs of the Republic of Turkey. Mr. Gul (Turkey): At the outset
2388,General debate,A_60_PV.19_E, 2005-09-21 ,Shareef,United Republic of Tanzania,Abdulkadeer  Shareef,TZA,Deputy Minister for Foreign Affairs and International Cooperation of the United Republic of Tanzania. 36 the United Republic of Tanzania
2389,General debate,A_60_PV.19_E, 2005-09-21 ,Mustafaj,Albania,Besnik  Mustafaj,ALB,Minister for Foreign Affairs of the Republic of Albania. Mr. Mustafaj (Albania) (spoke in French): Let me first convey
2390,General debate,A_60_PV.19_E, 2005-09-21 ,Ramazani Baya,Democratic Republic of the Congo,Raymond  Ramazani Baya,COD,Minister for Foreign Affairs and International Cooperation of the Democratic Republic of the Congo. Mr. Ramazani Baya (Democratic Republic of the Congo) (spoke in French): It is a pleasure to join preceding speakers in congratulating Mr. Jan Eliasson on his election as President at the sixtieth session of the General Assembly. In particular
2391,General debate,A_60_PV.19_E, 2005-09-21 ,Siosiua 'Utoikamanu (Tonga),Tonga,iosiua 'Utoikamanu ,TON,Minister for Finance of the Kingdom of Tonga. to congratulate Mr. TUtoikamanu (Tonga): May I first take this opportunity the President on his election to lead the work of the General Assembly. Let me also reassure him of Tongas support and full confidence that the sixtieth session of the General Assembly will be fruitful and successful under his very able leadership. I would also like to give due recognition to the sterling work of his predecessor
2392,General debate,A_60_PV.19_E, 2005-09-21 ,Barbosa Borges,Cape Verde,Victor Manuel  Barbosa Borges,CPV,Minister for Foreign Affairs
2393,General debate,A_60_PV.19_E, 2005-09-21 ,Abdullah,Afghanistan,Abdullah  Abdullah,AFG,Minister for Foreign Affairs of the Islamic Republic of Afghanistan. Mr. Abdullah (Afghanistan): I have the honour to inform the members of the General Assembly of the successful conclusion of the parliamentary and provincial elections that took place in my country two days ago. As stated by President Karzai
2394,General debate,A_60_PV.19_E, 2005-09-21 ,Abrehe,Eritrea,Berhane  Abrehe,ERI,Minister of Finance of Eritrea. Mr. Abrehe (Eritrea): Allow me to congratulate the President on his election to preside over the General Assembly at its sixtieth session. I wish to 22 assure him and his colleagues in the Bureau of my delegations support as he guides our deliberations. Allow me also to thank his predecessor
2395,General debate,A_60_PV.19_E, 2005-09-21 ,Nguyen,Viet Nam,Dy Nien  Nguyen,VNM,Minister for Foreign Affairs of the Socialist Republic of Viet Nam. Mr. Nguyen Dy Nien (Viet Nam): At the outset
2396,General debate,A_60_PV.19_E, 2005-09-21 ,Rotfeld,Poland,Adam Daniel  Rotfeld,POL,Minister for Foreign Affairs of the Republic of Poland. Mr. Rotfeld (Poland): Let me begin by congratulating President Jan Eliasson on his election. Allow me to assure him of Polands readiness to support him in his efforts during this session. I would also like to join the European Union presidency — to whose statement we fully adhere — in expressing my words of gratitude to His Excellency Mr. Jean Ping for his leadership during the preparations for the sixtieth anniversary summit. This year in Poland we are commemorating the twentieth anniversary of the Solidarity movement. In the history of Europe since the Second World War
2397,General debate,A_60_PV.19_E, 2005-09-21 ,Martynov,Belarus,Sergei N.  Martynov,BLR,Minister for Foreign Affairs of the Republic of Belarus. Mr. Martynov (Belarus) (spoke in Russian): 
2398,General debate,A_60_PV.19_E, 2005-09-21 ,Pandey,Nepal,Ramesh  Pandey,NPL,Minister for Foreign Affairs of the Kingdom of Nepal. Mr. Pandey (Nepal): 
2399,General debate,A_60_PV.19_E, 2005-09-21 ,Frendo,Malta,Michael  Frendo,MLT,Minister for Foreign Affairs of the Republic of Malta. Mr. Frendo (Malta): I would first to congratulate Mr. Jan Eliasson upon his election to the like 9 presidency of the General Assembly at its sixtieth session. He has an important and challenging task ahead. In carrying out his duties
