,Unnamed: 0,speech_type,proceeding,date,speaker_surname,country,speaker_name,country_code,position
3625,3625,General debate,A_66_PV.26_E, 2011-09-26 ,Al Nahyan,United Arab Emirates,Abdullah bin Zayed  Al Nahyan,ARE,Secretary of State for Foreign and Commonwealth Affairs of the United Arab Emirates. Sheikh Abdullah Bin Zayed Al Nahyan (United Arab Emirates) (spoke in Arabic): It is my pleasure to take this opportunity to congratulate the President of this session
3626,3626,General debate,A_66_PV.26_E, 2011-09-26 ,Medelci,Algeria,Mourad  Medelci,DZA,Minister for Foreign Affairs of the Peoples Democratic Republic of Algeria. Mr. Medelci (Algeria) (spoke in Arabic): His Excellency Mr. Abdelaziz Bouteflika
3627,3627,General debate,A_66_PV.26_E, 2011-09-26 ,Skarphedinsson,Iceland,Ossur  Skarphedinsson,ISL,Minister for Foreign Affairs and External Trade of the Republic of Iceland. Mr. Skarpheðinsson (Iceland): Let me start by congratulating His Excellency Ambassador Nassir Abdulaziz Al-Nasser on his election as President of the sixty-sixth session of the General Assembly
3628,3628,General debate,A_66_PV.26_E, 2011-09-26 ,Ganiev,Uzbekistan,Elyor  Ganiev,UZB,Deputy Prime Minister and Minister for Foreign Affairs of the Republic of Uzbekistan. Mr. Ganiev (Uzbekistan) (spoke in Russian): Allow me at the outset to extend my greetings to all those who are participating in the work of the General Assembly at its sixty-sixth session and to wish them every success in their endeavours. It gives me great pleasure to congratulate the Secretary-General
3614,3614,General debate,A_66_PV.27_E, 2011-09-26 ,Saboya,Andorra,Gilbert  Saboya,AND,Minister for Foreign Affairs and Institutional Relations of the Principality of Andorra. Mr. Saboya Sunye (Andorra) (spoke in Catalan; English text provided by the delegation): First of all
3615,3615,General debate,A_66_PV.27_E, 2011-09-26 ,Rambachan,Trinidad and Tobago,Surujrattan  Rambachan,TTO,Minister of Foreign Affairs and Communications of the Republic of Trinidad and Tobago. Mr. Rambachan (Trinidad and Tobago): Mr. President
3616,3616,General debate,A_66_PV.27_E, 2011-09-26 ,Gambi,Central African Republic,Antoine  Gambi,CAF,Minister for Foreign Affairs of the Central African Republic. Mr. Gambi (Central African Republic) (spoke in French): At the outset
3617,3617,General debate,A_66_PV.27_E, 2011-09-26 ,Ikouebe,Congo,Basile  Ikouebe,COG,Minister for Foreign Affairs and of la Francophonie of the Republic of the Congo. Mr. Ikouebe (Congo) (spoke in French): I am honoured to take the floor from this rostrum on behalf of the President of the Republic
3618,3618,General debate,A_66_PV.27_E, 2011-09-26 ,Santos López,Nicaragua,Samuel  Santos López,NIC,Minister for Foreign Affairs of Nicaragua. Mr. Santos Lopez (Nicaragua) (spoke in Spanish): At this general debate of the sixty-sixth session of the General Assembly
3619,3619,General debate,A_66_PV.27_E, 2011-09-26 ,Frick,Liechtenstein,Aurelia  Frick,LIE,Minister for Foreign Affairs
3592,3592,General debate,A_66_PV.28_E, 2011-09-27 ,Elrington,Belize,Wilfred P.  Elrington,BLZ,Attorney General and Minister for Foreign Affairs and Foreign Trade of Belize. Mr. Elrington (Belize): It is an honour for me to deliver this address on behalf of the people and the 19 Government of Belize. It is a particular privilege to do so with Mr. Al-Nasser at the helm of the Assembly. I say so because Belize has the distinct pleasure of having him as the Ambassador of Qatar to Belize
3593,3593,General debate,A_66_PV.28_E, 2011-09-27 ,Bako-Arifari,Benin,Nassirou   Bako-Arifari,BEN,Minister for Foreign Affairs
3594,3594,General debate,A_66_PV.28_E, 2011-09-27 ,Mamberti,Holy See,Dominique  Mamberti,VAT,Secretary for Relations with States of the Observer State of the Holy See. Archbishop Mamberti (Holy See) (spoke in French): I have the pleasure of congratulating you
3595,3595,General debate,A_66_PV.28_E, 2011-09-27 ,Tovichakchaikul,Thailand,Surapong  Tovichakchaikul,THA,Minister for Foreign Affairs of the Kingdom of Thailand. Mr. Tovichakchaikul (Thailand): On behalf of the delegation of the Kingdom of Thailand
3596,3596,General debate,A_66_PV.28_E, 2011-09-27 ,Lavrov,Russian Federation,Sergei Viktorovich  Lavrov,RUS,Minister for Foreign Affairs of the Russian Federation. Mr. Lavrov (Russian Federation) (spoke in Russian): This year the session of the General Assembly is opening at a time when international relations are in a state of turbulence. 
3597,3597,General debate,A_66_PV.28_E, 2011-09-27 ,Mutharika,Malawi,Arthur Peter  Mutharika,MWI,Minister for Foreign Affairs of the Republic of Malawi. Mr. Mutharika (Malawi): First of all
3598,3598,General debate,A_66_PV.28_E, 2011-09-27 ,Aman,Malaysia,Anifah  Aman,MYS,Minister for Foreign Affairs of Malaysia. Mr. Aman (Malaysia): I would like to take this opportunity to congratulate you
3599,3599,General debate,A_66_PV.28_E, 2011-09-27 ,Mammadyarov,Azerbaijan,Elmar Maharram oglu  Mammadyarov,AZE,Minister for Foreign Affairs of the Republic of Azerbaijan. Mr. Mammadyarov (Azerbaijan): I would like to join previous speakers in congratulating you
3600,3600,General debate,A_66_PV.28_E, 2011-09-27 ,Pham,Viet Nam,Binh Minh  Pham,VNM,Minister for Foreign Affairs of the Socialist Republic of Viet Nam. Mr. Pham Binh Minh (Viet Nam): On behalf of the Vietnamese delegation
3601,3601,General debate,A_66_PV.28_E, 2011-09-27 ,Lwin,Myanmar,Wunna Maung  Lwin,MMR,Minister for Foreign Affairs of the Republic of the Union of Myanmar. Mr. Lwin (Myanmar): Allow me to extend our congratulations to Mr. Nassir Abdulaziz Al-Nasser on his assumption of the Presidency of the General Assembly at its sixty-sixth session. I am confident that with his wide knowledge
3602,3602,General debate,A_66_PV.28_E, 2011-09-27 ,Bassolé,Burkina Faso,Djibrill Yipènè  Bassolé,BFA,Minister for Foreign Affairs and Regional Cooperation of Burkina Faso. Mr. Bassole (Burkina Faso) (spoke in French): 
3603,3603,General debate,A_66_PV.28_E, 2011-09-27 ,Al-Qirbi,Yemen,Abubakr A.  Al-Qirbi,YEM,Minister for Foreign Affairs of the Republic of Yemen. Mr. Al-Qirbi (Yemen) (spoke in Arabic): At the outset
3604,3604,General debate,A_66_PV.28_E, 2011-09-27 ,Martynov,Belarus,Sergei N.  Martynov,BLR,Minister for Foreign Affairs of the Republic of Belarus. Mr. Martynov (Belarus) (spoke in Russian): Much has been said from this rostrum in recent years about global governance. Yet in fact there is a pervasive feeling that chaos is inexorably engulfing our planet. Indeed
3605,3605,General debate,A_66_PV.28_E, 2011-09-27 ,Shanmugam,Singapore,K.  Shanmugam,SGP,Minister for Foreign Affairs of the Republic of Singapore. Mr. Shanmugam (Singapore): Allow me to congratulate Ambassador Nassir Abdulaziz Al-Nasser on his election as President of the General Assembly at its sixty-sixth session. I would also like to congratulate Secretary-General Ban Ki-moon on his unanimous reappointment to a second term. I extend my warmest congratulations to South Sudan on becoming the newest Member of the United Nations family. We wish President Al-Nasser and Secretary-General Ban success in the year ahead. 
3606,3606,General debate,A_66_PV.28_E, 2011-09-27 ,Mularoni,San Marino,Antonella  Mularoni,SMR,Minister for Foreign and Political Affairs
3607,3607,General debate,A_66_PV.28_E, 2011-09-27 ,Hamadi,Mauritania,Hamadi Ould Baba Ould  Hamadi,MRT,Minister for Foreign Affairs and Cooperation of the Islamic Republic of Mauritania. Mr. Ould Hamady (Mauritania) (spoke in Arabic): It is my honour and pleasure at the outset of this brief statement to welcome and congratulate the Republic of South Sudan upon its accession to membership in the United Nations and for its participation for the first time in the work of the General Assembly. I am also happy to warmly congratulate Mr. Nassir Abdulaziz Al-Nasser on his election to the presidency of the Assembly at its sixty-sixth session. Allow me to express our full confidence in him as he undertakes the exceptional efforts required to strengthen the progress achieved to date in terms of international peace and security
3582,3582,General debate,A_66_PV.29_E, 2011-09-27 ,McLay,New Zealand,Jim  McLay,NZL,chair of the delegation of New Zealand. Mr. McLay (New Zealand): As we say in Maori
3583,3583,General debate,A_66_PV.29_E, 2011-09-27 ,Carrión Mena,Ecuador,Francisco  Carrión Mena,ECU,chair of the delegation of Ecuador. Mr. Carrion-Mena (Ecuador) (spoke in Spanish): In June 2009
3584,3584,General debate,A_66_PV.29_E, 2011-09-27 ,Cujba,Republic of Moldova,Alexandru  Cujba,MDA,chair of the delegation of the Republic of Moldova. Mr. Cujba (Republic of Moldova): It is a great honour and privilege to take part in the general debate and to represent my country on this rostrum at a significant juncture in Moldovas modern history
3585,3585,General debate,A_66_PV.29_E, 2011-09-27 ,Mungoma,Zambia,Lucy  Mungoma,ZMB,Permanent Secretary at the Ministry of Foreign Affairs of Zambia. Ms. Mungoma (Zambia): I wish
3586,3586,General debate,A_66_PV.29_E, 2011-09-27 ,Eide,Norway,Espen Barth  Eide,NOR,Deputy Minister for Foreign Affairs of Norway. Mr. Eide (Norway): Since we last met here
3587,3587,General debate,A_66_PV.29_E, 2011-09-27 ,Soto,Panama,Francisco Álvarez de  Soto,PAN,Deputy Minister for Foreign Affairs of the Republic of Panama. Mr. Alvarez de Soto (Panama) (spoke in Spanish): It is an honour for me to address the international community
3588,3588,General debate,A_66_PV.29_E, 2011-09-27 ,Khar,Pakistan,Hina Rabbani  Khar,PAK,Minister for Foreign Affairs of Pakistan. Ms. Khar (Pakistan): I am honoured to be here today and to represent the brave and resilient people of Pakistan before the Assembly. As participants may know
3589,3589,General debate,A_66_PV.29_E, 2011-09-27 ,Maduro Moros,Venezuela,Nicolás  Maduro Moros,VEN,Minister of the Peoples Power for Foreign Affairs of the Bolivarian Republic of Venezuela. Mr. Maduro Moros (Bolivarian Republic of Venezuela) (spoke in Spanish): It is almost the end of the beginning of the annual debate in United Nations. Having listened to and evaluated positions on different world issues debated by the planet and all of humanity
3590,3590,General debate,A_66_PV.29_E, 2011-09-27 ,Costea,Romania,Doru-Romulus  Costea,ROU,Deputy Minister for Foreign Affairs of Romania. Mr. Costea (Romania) (spoke in French): At the outset
3591,3591,General debate,A_66_PV.29_E, 2011-09-27 ,Pak,Democratic People's Republic of Korea,Gil Yon  Pak,PRK,Mr. Syed Yusuf Raza Gilani
3608,3608,General debate,A_66_PV.30_E, 2011-09-27 ,Al-Nasser,UN,Nassir Abdulaziz  Al-Nasser,UN,His Excellency Mr. Joseph Deiss
3609,3609,General debate,A_66_PV.30_E, 2011-09-27 ,Nazarian,Armenia,Garen  Nazarian,ARM,
3610,3610,General debate,A_66_PV.30_E, 2011-09-27 ,Musayev,Azerbaijan,Tofig  Musayev,AZE,
3611,3611,General debate,A_66_PV.30_E, 2011-09-27 ,St. Aimee,Saint Lucia,Donatus Keith  St. Aimee,LCA,chairman of the delegation of Saint Lucia. Mr. St. Aimee (Saint Lucia): Not since the prelude to the two world wars have there been so much uncertainty and anxiety within the international system. 
3612,3612,General debate,A_66_PV.30_E, 2011-09-27 ,Henderson,Dominica,Vince  Henderson,DMA,chairman of the delegation of the Commonwealth of Dominica. Mr. Henderson (Dominica): On behalf of my delegation and the Government and the people of the Commonwealth of Dominica
3613,3613,General debate,A_66_PV.30_E, 2011-09-27 ,Cabactulan,Philippines,Libran N.  Cabactulan,PHL,chairman of the delegation of the Philippines. Mr. Cabactulan (Philippines): Allow me at the outset to congratulate Ambassador Nassir Abdulaziz Al-Nasser on his election and to offer the Philippines full support for his leadership in this sixty-sixth session of the General Assembly. Our collective experience as one United Nations has brought into focus the reality that only when nations work together in firm and determined resolve can we begin to address the many difficulties that confront us. Two global wars exposed our vulnerability to leaders and nations that do not hesitate to use violence to resolve disputes and underscored the need for an international system to govern the behaviour of States. That is the rules-based framework that underpins everything we want to build
