,speech_type,proceeding,date,speaker_surname,country,speaker_name,country_code,position
1055,General debate,A_53_PV.25_E, 1998-10-02 ,McKenzie,Trinidad and Tobago,George  McKenzie,TTO,and to the victims of the floods in the Peoples Republic of China and in Bangladesh. I am pleased to be able to join with the distinguished and worthy representatives of States and Governments who have preceded me at this rostrum in extending to you
1056,General debate,A_53_PV.25_E, 1998-10-02 ,Milo,Albania,Paskal  Milo,ALB,Minister for Foreign Affairs of Albania
1057,General debate,A_53_PV.25_E, 1998-10-02 ,Himidi,Comoros,Salim  Himidi,COM,on whom I now call. Mr. Himidi (Comoros) (interpretation from French): Allow me at the outset
1058,General debate,A_53_PV.25_E, 1998-10-02 ,Witt,Ecuador,Jamil Mahuad  Witt,ECU,Constitutional President of the Republic of Ecuador 
1059,General debate,A_53_PV.26_E, 1998-10-02 ,Ferreira,Sao Tome and Principe,Domingos Augusto  Ferreira,STP,Chairman of the delegation of Sao Tome and Principe. Mr. Ferreira (Sao Tome and Principe): On behalf of the people and the Government of Sao Tome and Principe
1060,General debate,A_53_PV.26_E, 1998-10-02 ,Vohidov,Uzbekistan,Alisher  Vohidov,UZB,
1061,General debate,A_53_PV.26_E, 1998-10-02 ,Menagarishvili,Georgia,Irakli  Menagarishvili,GEO,
1062,General debate,A_53_PV.26_E, 1998-10-02 ,Miranda,Angola,Joao Bernardo de  Miranda,AGO,
1063,General debate,A_53_PV.26_E, 1998-10-02 ,Longchamp,Haiti,Fritz  Longchamp,HTI,Minister for Foreign Affairs and Worship of Haiti. 7 General Assembly Fifty-third session Mr. Longchamp (Haiti) (interpretation from French): It is a true pleasure for me to address the General Assembly once more. I wish first of all to echo previous speakers in congratulating you most warmly
1064,General debate,A_53_PV.26_E, 1998-10-02 ,Gasana,Rwanda,Anastase  Gasana,RWA,was based on pure and concrete facts. 
1065,General debate,A_53_PV.26_E, 1998-10-02 ,Silva,Guinea-Bissau,Fernando Delfim da  Silva,GNB,Minister for Foreign Affairs and Cooperation of Guinea-Bissau on whom I now call. Mr. Da Silva (Guinea-Bissau) (spoke in Portuguese; the from French furnished text interpretation by delegation): On behalf of the delegation of Guinea-Bissau
1218,General debate,A_53_PV.7_E, 1998-09-21 ,Blair,United Kingdom,Tony  Blair,GBR,Prime Minister of the United Kingdom of Great Britain and Northern Ireland 
1219,General debate,A_53_PV.7_E, 1998-09-21 ,Kumaratunga,Sri Lanka,Chandrika  Kumaratunga,LKA,President of the Democratic Socialist Republic of Sri Lanka 
1220,General debate,A_53_PV.7_E, 1998-09-21 ,Sanguinetti,Uruguay,Julio María  Sanguinetti,URY,President of the Eastern Republic of Uruguay 
1221,General debate,A_53_PV.7_E, 1998-09-21 ,Compaoré,Burkina Faso,Blaise  Compaoré,BFA,President of Burkina Faso 
1222,General debate,A_53_PV.7_E, 1998-09-21 ,Mandela,South Africa,Nelson  Mandela,ZAF,President of the Republic of South Africa 
1223,General debate,A_53_PV.7_E, 1998-09-21 ,Clinton,United States,Bill  Clinton,USA,President of the United States of America 7th plenary meeting 21 September 1998 
1224,General debate,A_53_PV.7_E, 1998-09-21 ,Lampreia,Brazil,Luiz Felipe Palmeira  Lampreia,BRA,
1208,General debate,A_53_PV.8_E, 1998-09-21 ,Bajammal,Yemen,Abdulqader  Bajammal,YEM,
1209,General debate,A_53_PV.8_E, 1998-09-21 ,Essy,Côte d'Ivoire,Amara  Essy,CIV,
1210,General debate,A_53_PV.8_E, 1998-09-21 ,Vollebaek,Norway,Knut  Vollebaek,NOR,
1211,General debate,A_53_PV.8_E, 1998-09-21 ,Alatas,Indonesia,Ali  Alatas,IDN,we endorse the Declaration issued by its thirteenth Summit
1212,General debate,A_53_PV.8_E, 1998-09-21 ,Tella,Argentina,Guido di  Tella,ARG,
1213,General debate,A_53_PV.8_E, 1998-09-21 ,Obuchi,Japan,Keizo  Obuchi,JPN,Prime Minister of Japan 
1214,General debate,A_53_PV.8_E, 1998-09-21 ,Skate,Papua New Guinea,William  Skate,PNG,Prime Minister of Papua New Guinea 
1215,General debate,A_53_PV.8_E, 1998-09-21 ,Green,Mexico,Rosario  Green,MEX,
1216,General debate,A_53_PV.8_E, 1998-09-21 ,Khatami,Iran,Seyed Mohammad  Khatami,IRN,President of the Islamic Republic of Iran 
1217,General debate,A_53_PV.8_E, 1998-09-21 ,Ulmanis,Latvia,Guntis  Ulmanis,LVA,President of Republic of Latvia the 
1202,General debate,A_53_PV.9_E, 1998-09-22 ,Ferrero Costa,Peru,Eduardo  Ferrero Costa,PER,
1203,General debate,A_53_PV.9_E, 1998-09-22 ,Azad,Bangladesh,Abdus Samad  Azad,BGD,
1204,General debate,A_53_PV.9_E, 1998-09-22 ,Wensley,Australia,Penny  Wensley,AUS,
1205,General debate,A_53_PV.9_E, 1998-09-22 ,Ivanov,Russian Federation,I.S.  Ivanov,RUS,Minister for Foreign Affairs of the Russian Federation. 20 9th plenary meeting 22 September 1998 Mr. Ivanov (Russian Federation) (interpretation from Russian): Mankind is increasingly feeling the winds of the twenty-first century. What they bring depends on all of us
1206,General debate,A_53_PV.9_E, 1998-09-22 ,Kinkel,Germany,Klaus  Kinkel,DEU,
1207,General debate,A_53_PV.9_E, 1998-09-22 ,Buyoya,Burundi,Pierre  Buyoya,BDI,President of Republic of Burundi the 
